{
  "feedback_schema_version": 1,
  "run_id": "20260905T135144Z",
  "run_kind": "integration",
  "commit": {"head": "8fbf576301caadbd69c452638329ab1d1b734969", "dirty": true},
  "started_at": "2026-09-05T13:51:44Z",
  "finished_at": "2026-09-05T13:52:03Z",
  "status": "passed",
  "steps": [{"name":"build","status":"passed","started_at":null,"finished_at":null,"exit_code":0},{"name":"unit_test","status":"passed","started_at":null,"finished_at":null,"exit_code":0},{"name":"deploy","status":"passed","started_at":null,"finished_at":null,"exit_code":0},{"name":"server_readiness","status":"passed","started_at":null,"finished_at":null,"exit_code":0},{"name":"plugin_enable","status":"passed","started_at":null,"finished_at":null,"exit_code":0},{"name":"smoke_check","status":"passed","started_at":null,"finished_at":null,"exit_code":0},{"name":"cleanup","status":"passed","started_at":null,"finished_at":null,"exit_code":0}],
  "artifact": {"path":"/Users/yancy/Documents/ChatGPT/Minecraft/Server/runtime/plugins/rpg-engine-plugin-0.1.0.jar","sha256":"b247d0b38b5ad7b8d55095ec265b73568d083afe2ed6da8c1f2f881906ae6f33"},
  "server": {"log":"/Users/yancy/Documents/ChatGPT/Minecraft/Server/runtime/server.log","ready":true,"exit_code":0},
  "errors": ["Detailed step records are attached by the pipeline."]
}
