{
  "feedback_schema_version": 1,
  "run_id": "20260905T124938Z",
  "run_kind": "build",
  "commit": {"head": "518a081c46352202d8dc79aa941c803443505c83", "dirty": true},
  "started_at": "2026-09-05T12:49:38Z",
  "finished_at": "2026-09-05T12:49:39Z",
  "status": "passed",
  "steps": [],
  "artifact": null,
  "server": null,
  "errors": ["Detailed step records are attached by the pipeline."]
}
