{
  "feedback_schema_version": 1,
  "run_id": "20260905T124506Z",
  "run_kind": "build",
  "commit": {"head": "de778462dea3f2f769d87e2687adba9f602340af", "dirty": ""},
  "started_at": "2026-09-05T12:45:06Z",
  "finished_at": "2026-09-05T12:45:06Z",
  "status": "passed",
  "steps": [],
  "artifact": null,
  "server": null,
  "errors": ["Detailed step records are attached by the pipeline."]
}
