{
  "feedback_schema_version": 1,
  "run_id": "20260905T125012Z",
  "run_kind": "integration",
  "commit": {"head": "518a081c46352202d8dc79aa941c803443505c83", "dirty": true},
  "started_at": "2026-09-05T12:50:12Z",
  "finished_at": "2026-09-05T12:50:13Z",
  "status": "failed",
  "steps": [],
  "artifact": null,
  "server": null,
  "errors": ["Detailed step records are attached by the pipeline."]
}
