{
  "feedback_schema_version": 1,
  "run_id": "20260905T135648Z",
  "run_kind": "integration",
  "commit": {"head": "2a1fd716c58c03fd634ea0524f6fbb2a38578651", "dirty": true},
  "started_at": "2026-09-05T13:56:48Z",
  "finished_at": "2026-09-05T13:57:33Z",
  "status": "failed",
  "steps": [{"name":"build","status":"failed","started_at":null,"finished_at":null,"exit_code":1},{"name":"unit_test","status":"failed","started_at":null,"finished_at":null,"exit_code":1},{"name":"deploy","status":"failed","started_at":null,"finished_at":null,"exit_code":1},{"name":"server_readiness","status":"failed","started_at":null,"finished_at":null,"exit_code":1},{"name":"plugin_enable","status":"failed","started_at":null,"finished_at":null,"exit_code":1},{"name":"smoke_check","status":"failed","started_at":null,"finished_at":null,"exit_code":1},{"name":"cleanup","status":"failed","started_at":null,"finished_at":null,"exit_code":1}],
  "artifact": {"path":"/Users/yancy/Documents/ChatGPT/Minecraft/Server/runtime/plugins/rpg-engine-plugin-0.1.0.jar","sha256":"52c2bd426ad25f25222fc530c82bd94b7f2e2731b463e7ee1ea574a328d8320a"},
  "server": {"log":"/Users/yancy/Documents/ChatGPT/Minecraft/Server/runtime/server.log","ready":true,"exit_code":0},
  "errors": ["Detailed step records are attached by the pipeline."]
}
